smartctl 7.2 2020-12-30 r5155 [x86_64-linux-6.8.0-49-generic] (local build)
Copyright (C) 2002-20, Bruce Allen, Christian Franke, www.smartmontools.org

=== START OF INFORMATION SECTION ===
Device Model:     MK000960GZXRB
Serial Number:    S6M7NE0T800257
LU WWN Device Id: 5 002538 f02814742
Firmware Version: HPG0
User Capacity:    960,197,124,096 bytes [960 GB]
Sector Sizes:     512 bytes logical, 4096 bytes physical
Rotation Rate:    Solid State Device
Form Factor:      2.5 inches
TRIM Command:     Available, deterministic, zeroed
Device is:        Not in smartctl database [for details use: -P showall]
ATA Version is:   ACS-4, ACS-3 T13/2161-D revision 5
SATA Version is:  SATA 3.3, 6.0 Gb/s (current: 6.0 Gb/s)
Local Time is:    Fri Dec 13 17:02:22 2024 CST
SMART support is: Available - device has SMART capability.
SMART support is: Enabled
AAM feature is:   Unavailable
APM feature is:   Unavailable
Rd look-ahead is: Enabled
Write cache is:   Disabled
DSN feature is:   Unavailable
ATA Security is:  Unavailable
Wt Cache Reorder: Unavailable

=== START OF READ SMART DATA SECTION ===
SMART overall-health self-assessment test result: PASSED

General SMART Values:
Offline data collection status:  (0x00)	Offline data collection activity
					was never started.
					Auto Offline Data Collection: Disabled.
Self-test execution status:      (   0)	The previous self-test routine completed
					without error or no self-test has ever 
					been run.
Total time to complete Offline 
data collection: 		(    0) seconds.
Offline data collection
capabilities: 			 (0x53) SMART execute Offline immediate.
					Auto Offline data collection on/off support.
					Suspend Offline collection upon new
					command.
					No Offline surface scan supported.
					Self-test supported.
					No Conveyance Self-test supported.
					Selective Self-test supported.
SMART capabilities:            (0x0003)	Saves SMART data before entering
					power-saving mode.
					Supports SMART auto save timer.
Error logging capability:        (0x01)	Error logging supported.
					General Purpose Logging supported.
Short self-test routine 
recommended polling time: 	 (   2) minutes.
Extended self-test routine
recommended polling time: 	 (  60) minutes.
SCT capabilities: 	       (0x0025)	SCT Status supported.
					SCT Data Table supported.

SMART Attributes Data Structure revision number: 1
Vendor Specific SMART Attributes with Thresholds:
ID# ATTRIBUTE_NAME          FLAGS    VALUE WORST THRESH FAIL RAW_VALUE
  1 Raw_Read_Error_Rate     POSR--   200   200   002    -    0
  5 Reallocated_Sector_Ct   PO--CK   100   100   005    -    0
  9 Power_On_Hours          -O--CK   099   099   000    -    1277
 12 Power_Cycle_Count       -O--CK   099   099   000    -    55
171 Unknown_Attribute       -O--CK   100   100   000    -    0
172 Unknown_Attribute       -O--CK   100   100   000    -    0
173 Unknown_Attribute       PO--CK   099   099   005    -    3
174 Unknown_Attribute       -O--CK   100   100   000    -    0
175 Program_Fail_Count_Chip PO--CK   100   100   001    -    0
180 Unused_Rsvd_Blk_Cnt_Tot PO-RCK   200   200   097    -    0
187 Reported_Uncorrect      -O--CK   100   100   000    -    0
194 Temperature_Celsius     -O---K   083   077   000    -    17
196 Reallocated_Event_Count PO--CK   100   100   005    -    0
197 Current_Pending_Sector  -O--C-   100   100   000    -    0
198 Offline_Uncorrectable   ----C-   100   100   000    -    0
199 UDMA_CRC_Error_Count    -OSRCK   100   100   000    -    0
202 Unknown_SSD_Attribute   PO--CK   100   100   010    -    0
                            ||||||_ K auto-keep
                            |||||__ C event count
                            ||||___ R error rate
                            |||____ S speed/performance
                            ||_____ O updated online
                            |______ P prefailure warning

General Purpose Log Directory Version 1
SMART           Log Directory Version 1 [multi-sector log support]
Address    Access  R/W   Size  Description
0x00       GPL,SL  R/O      1  Log Directory
0x03       GPL     R/O      1  Ext. Comprehensive SMART error log
0x04       GPL,SL  R/O      8  Device Statistics log
0x07       GPL     R/O      1  Extended self-test log
0x09           SL  R/W      1  Selective self-test log
0x0c       GPL     R/O      1  Pending Defects log
0x0d       GPL     R/O      1  LPS Mis-alignment log
0x10       GPL     R/O      1  NCQ Command Error log
0x11       GPL     R/O      1  SATA Phy Event Counters log
0x30       GPL     R/O      9  IDENTIFY DEVICE data log
0x80       GPL     R/W     16  Host vendor specific log
0x81-0x9f  GPL,SL  R/W     16  Host vendor specific log
0xb6       GPL     VS       1  Device vendor specific log
0xbb       GPL     VS       1  Device vendor specific log
0xd0       GPL     VS       1  Device vendor specific log
0xd7       GPL     VS       1  Device vendor specific log
0xe0       GPL,SL  R/W      1  SCT Command/Status
0xe1       GPL,SL  R/W      1  SCT Data Transfer

SMART Extended Comprehensive Error Log Version: 1 (1 sectors)
No Errors Logged

SMART Extended Self-test Log Version: 1 (1 sectors)
No self-tests have been logged.  [To run self-tests, use: smartctl -t]

SMART Selective self-test log data structure revision number 1
 SPAN  MIN_LBA  MAX_LBA  CURRENT_TEST_STATUS
    1        0        0  Not_testing
    2        0        0  Not_testing
    3        0        0  Not_testing
    4        0        0  Not_testing
    5        0        0  Not_testing
  256        0    65535  Read_scanning was never started
Selective self-test flags (0x0):
  After scanning selected spans, do NOT read-scan remainder of disk.
If Selective self-test is pending on power-up, resume after 0 minute delay.

SCT Status Version:                  3
SCT Version (vendor specific):       256 (0x0100)
Device State:                        Active (0)
Current Temperature:                    17 Celsius
Power Cycle Min/Max Temperature:     17/24 Celsius
Lifetime    Min/Max Temperature:     11/24 Celsius
Specified Max Operating Temperature:    60 Celsius
Under/Over Temperature Limit Count:   0/0
SMART Status:                        0xc24f (PASSED)

SCT Temperature History Version:     2
Temperature Sampling Period:         10 minutes
Temperature Logging Interval:        10 minutes
Min/Max recommended Temperature:      0/60 Celsius
Min/Max Temperature Limit:            0/60 Celsius
Temperature History Size (Index):    128 (107)

Index    Estimated Time   Temperature Celsius
 108    2024-12-12 19:50    19  -
 ...    ..(  4 skipped).    ..  -
 113    2024-12-12 20:40    19  -
 114    2024-12-12 20:50    20  *
 115    2024-12-12 21:00    19  -
 ...    ..( 77 skipped).    ..  -
  65    2024-12-13 10:00    19  -
  66    2024-12-13 10:10     ?  -
  67    2024-12-13 10:20     ?  -
  68    2024-12-13 10:30    19  -
  69    2024-12-13 10:40    19  -
  70    2024-12-13 10:50     ?  -
  71    2024-12-13 11:00     ?  -
  72    2024-12-13 11:10     ?  -
  73    2024-12-13 11:20    19  -
 ...    ..(  7 skipped).    ..  -
  81    2024-12-13 12:40    19  -
  82    2024-12-13 12:50     ?  -
 ...    ..(  5 skipped).    ..  -
  88    2024-12-13 13:50     ?  -
  89    2024-12-13 14:00    19  -
  90    2024-12-13 14:10    19  -
  91    2024-12-13 14:20     ?  -
  92    2024-12-13 14:30    19  -
 ...    ..(  2 skipped).    ..  -
  95    2024-12-13 15:00    19  -
  96    2024-12-13 15:10    20  *
  97    2024-12-13 15:20    19  -
 ...    ..(  2 skipped).    ..  -
 100    2024-12-13 15:50    19  -
 101    2024-12-13 16:00     ?  -
 102    2024-12-13 16:10    19  -
 ...    ..(  2 skipped).    ..  -
 105    2024-12-13 16:40    19  -
 106    2024-12-13 16:50     ?  -
 107    2024-12-13 17:00     ?  -

SCT Error Recovery Control command not supported

Device Statistics (GP Log 0x04)
Page  Offset Size        Value Flags Description
0x01  =====  =               =  ===  == General Statistics (rev 1) ==
0x01  0x008  4              55  ---  Lifetime Power-On Resets
0x01  0x010  4            1277  ---  Power-on Hours
0x01  0x018  6      2722773298  ---  Logical Sectors Written
0x01  0x020  6        50587134  ---  Number of Write Commands
0x01  0x028  6      2154350733  ---  Logical Sectors Read
0x01  0x030  6        17561881  ---  Number of Read Commands
0x01  0x038  6         2394000  ---  Date and Time TimeStamp
0x04  =====  =               =  ===  == General Errors Statistics (rev 1) ==
0x04  0x008  4               0  ---  Number of Reported Uncorrectable Errors
0x04  0x010  4               0  ---  Resets Between Cmd Acceptance and Completion
0x05  =====  =               =  ===  == Temperature Statistics (rev 1) ==
0x05  0x008  1              17  ---  Current Temperature
0x05  0x020  1              24  ---  Highest Temperature
0x05  0x028  1              11  ---  Lowest Temperature
0x05  0x058  1              60  ---  Specified Maximum Operating Temperature
0x06  =====  =               =  ===  == Transport Statistics (rev 1) ==
0x06  0x008  4             124  ---  Number of Hardware Resets
0x06  0x010  4               0  ---  Number of ASR Events
0x06  0x018  4               0  ---  Number of Interface CRC Errors
0x07  =====  =               =  ===  == Solid State Device Statistics (rev 1) ==
0x07  0x008  1               0  N--  Percentage Used Endurance Indicator
                                |||_ C monitored condition met
                                ||__ D supports DSN
                                |___ N normalized value

Pending Defects log (GP Log 0x0c)
No Defects Logged

SATA Phy Event Counters (GP Log 0x11)
ID      Size     Value  Description
0x0001  2            0  Command failed due to ICRC error
0x0002  2            0  R_ERR response for data FIS
0x0003  2            0  R_ERR response for device-to-host data FIS
0x0004  2            0  R_ERR response for host-to-device data FIS
0x0005  2            0  R_ERR response for non-data FIS
0x0006  2            0  R_ERR response for device-to-host non-data FIS
0x0007  2            0  R_ERR response for host-to-device non-data FIS
0x0008  2            0  Device-to-host non-data FIS retries
0x0009  2            0  Transition from drive PhyRdy to drive PhyNRdy
0x000a  2            0  Device-to-host register FISes sent due to a COMRESET
0x000b  2            0  CRC errors within host-to-device FIS
0x000d  2            0  Non-CRC errors within host-to-device FIS
0x000f  2            0  R_ERR response for host-to-device data FIS, CRC
0x0010  2            0  R_ERR response for host-to-device data FIS, non-CRC
0x0012  2            0  R_ERR response for host-to-device non-data FIS, CRC
0x0013  2            0  R_ERR response for host-to-device non-data FIS, non-CRC


smartctl 7.2 2020-12-30 r5155 [x86_64-linux-6.8.0-49-generic] (local build)
Copyright (C) 2002-20, Bruce Allen, Christian Franke, www.smartmontools.org

=== START OF INFORMATION SECTION ===
Device Model:     MK000960GZXRB
Serial Number:    S6M7NE0T800257
LU WWN Device Id: 5 002538 f02814742
Firmware Version: HPG0
User Capacity:    960,197,124,096 bytes [960 GB]
Sector Sizes:     512 bytes logical, 4096 bytes physical
Rotation Rate:    Solid State Device
Form Factor:      2.5 inches
TRIM Command:     Available, deterministic, zeroed
Device is:        Not in smartctl database [for details use: -P showall]
ATA Version is:   ACS-4, ACS-3 T13/2161-D revision 5
SATA Version is:  SATA 3.3, 6.0 Gb/s (current: 6.0 Gb/s)
Local Time is:    Fri Dec 13 17:08:01 2024 CST
SMART support is: Available - device has SMART capability.
SMART support is: Enabled
AAM feature is:   Unavailable
APM feature is:   Unavailable
Rd look-ahead is: Enabled
Write cache is:   Disabled
DSN feature is:   Unavailable
ATA Security is:  Unavailable
Wt Cache Reorder: Unavailable

=== START OF READ SMART DATA SECTION ===
SMART overall-health self-assessment test result: PASSED

General SMART Values:
Offline data collection status:  (0x00)	Offline data collection activity
					was never started.
					Auto Offline Data Collection: Disabled.
Self-test execution status:      (   0)	The previous self-test routine completed
					without error or no self-test has ever 
					been run.
Total time to complete Offline 
data collection: 		(    0) seconds.
Offline data collection
capabilities: 			 (0x53) SMART execute Offline immediate.
					Auto Offline data collection on/off support.
					Suspend Offline collection upon new
					command.
					No Offline surface scan supported.
					Self-test supported.
					No Conveyance Self-test supported.
					Selective Self-test supported.
SMART capabilities:            (0x0003)	Saves SMART data before entering
					power-saving mode.
					Supports SMART auto save timer.
Error logging capability:        (0x01)	Error logging supported.
					General Purpose Logging supported.
Short self-test routine 
recommended polling time: 	 (   2) minutes.
Extended self-test routine
recommended polling time: 	 (  60) minutes.
SCT capabilities: 	       (0x0025)	SCT Status supported.
					SCT Data Table supported.

SMART Attributes Data Structure revision number: 1
Vendor Specific SMART Attributes with Thresholds:
ID# ATTRIBUTE_NAME          FLAGS    VALUE WORST THRESH FAIL RAW_VALUE
  1 Raw_Read_Error_Rate     POSR--   200   200   002    -    0
  5 Reallocated_Sector_Ct   PO--CK   100   100   005    -    0
  9 Power_On_Hours          -O--CK   099   099   000    -    1277
 12 Power_Cycle_Count       -O--CK   099   099   000    -    56
171 Unknown_Attribute       -O--CK   100   100   000    -    0
172 Unknown_Attribute       -O--CK   100   100   000    -    0
173 Unknown_Attribute       PO--CK   099   099   005    -    3
174 Unknown_Attribute       -O--CK   100   100   000    -    0
175 Program_Fail_Count_Chip PO--CK   100   100   001    -    0
180 Unused_Rsvd_Blk_Cnt_Tot PO-RCK   200   200   097    -    0
187 Reported_Uncorrect      -O--CK   100   100   000    -    0
194 Temperature_Celsius     -O---K   083   077   000    -    17
196 Reallocated_Event_Count PO--CK   100   100   005    -    0
197 Current_Pending_Sector  -O--C-   100   100   000    -    0
198 Offline_Uncorrectable   ----C-   100   100   000    -    0
199 UDMA_CRC_Error_Count    -OSRCK   100   100   000    -    0
202 Unknown_SSD_Attribute   PO--CK   100   100   010    -    0
                            ||||||_ K auto-keep
                            |||||__ C event count
                            ||||___ R error rate
                            |||____ S speed/performance
                            ||_____ O updated online
                            |______ P prefailure warning

General Purpose Log Directory Version 1
SMART           Log Directory Version 1 [multi-sector log support]
Address    Access  R/W   Size  Description
0x00       GPL,SL  R/O      1  Log Directory
0x03       GPL     R/O      1  Ext. Comprehensive SMART error log
0x04       GPL,SL  R/O      8  Device Statistics log
0x07       GPL     R/O      1  Extended self-test log
0x09           SL  R/W      1  Selective self-test log
0x0c       GPL     R/O      1  Pending Defects log
0x0d       GPL     R/O      1  LPS Mis-alignment log
0x10       GPL     R/O      1  NCQ Command Error log
0x11       GPL     R/O      1  SATA Phy Event Counters log
0x30       GPL     R/O      9  IDENTIFY DEVICE data log
0x80       GPL     R/W     16  Host vendor specific log
0x81-0x9f  GPL,SL  R/W     16  Host vendor specific log
0xb6       GPL     VS       1  Device vendor specific log
0xbb       GPL     VS       1  Device vendor specific log
0xd0       GPL     VS       1  Device vendor specific log
0xd7       GPL     VS       1  Device vendor specific log
0xe0       GPL,SL  R/W      1  SCT Command/Status
0xe1       GPL,SL  R/W      1  SCT Data Transfer

SMART Extended Comprehensive Error Log Version: 1 (1 sectors)
No Errors Logged

SMART Extended Self-test Log Version: 1 (1 sectors)
No self-tests have been logged.  [To run self-tests, use: smartctl -t]

SMART Selective self-test log data structure revision number 1
 SPAN  MIN_LBA  MAX_LBA  CURRENT_TEST_STATUS
    1        0        0  Not_testing
    2        0        0  Not_testing
    3        0        0  Not_testing
    4        0        0  Not_testing
    5        0        0  Not_testing
  256        0    65535  Read_scanning was never started
Selective self-test flags (0x0):
  After scanning selected spans, do NOT read-scan remainder of disk.
If Selective self-test is pending on power-up, resume after 0 minute delay.

SCT Status Version:                  3
SCT Version (vendor specific):       256 (0x0100)
Device State:                        Active (0)
Current Temperature:                    17 Celsius
Power Cycle Min/Max Temperature:     17/24 Celsius
Lifetime    Min/Max Temperature:     11/24 Celsius
Specified Max Operating Temperature:    60 Celsius
Under/Over Temperature Limit Count:   0/0
SMART Status:                        0xc24f (PASSED)

SCT Temperature History Version:     2
Temperature Sampling Period:         10 minutes
Temperature Logging Interval:        10 minutes
Min/Max recommended Temperature:      0/60 Celsius
Min/Max Temperature Limit:            0/60 Celsius
Temperature History Size (Index):    128 (108)

Index    Estimated Time   Temperature Celsius
 109    2024-12-12 19:50    19  -
 ...    ..(  3 skipped).    ..  -
 113    2024-12-12 20:30    19  -
 114    2024-12-12 20:40    20  *
 115    2024-12-12 20:50    19  -
 ...    ..( 77 skipped).    ..  -
  65    2024-12-13 09:50    19  -
  66    2024-12-13 10:00     ?  -
  67    2024-12-13 10:10     ?  -
  68    2024-12-13 10:20    19  -
  69    2024-12-13 10:30    19  -
  70    2024-12-13 10:40     ?  -
  71    2024-12-13 10:50     ?  -
  72    2024-12-13 11:00     ?  -
  73    2024-12-13 11:10    19  -
 ...    ..(  7 skipped).    ..  -
  81    2024-12-13 12:30    19  -
  82    2024-12-13 12:40     ?  -
 ...    ..(  5 skipped).    ..  -
  88    2024-12-13 13:40     ?  -
  89    2024-12-13 13:50    19  -
  90    2024-12-13 14:00    19  -
  91    2024-12-13 14:10     ?  -
  92    2024-12-13 14:20    19  -
 ...    ..(  2 skipped).    ..  -
  95    2024-12-13 14:50    19  -
  96    2024-12-13 15:00    20  *
  97    2024-12-13 15:10    19  -
 ...    ..(  2 skipped).    ..  -
 100    2024-12-13 15:40    19  -
 101    2024-12-13 15:50     ?  -
 102    2024-12-13 16:00    19  -
 ...    ..(  2 skipped).    ..  -
 105    2024-12-13 16:30    19  -
 106    2024-12-13 16:40     ?  -
 107    2024-12-13 16:50     ?  -
 108    2024-12-13 17:00     ?  -

SCT Error Recovery Control command not supported

Device Statistics (GP Log 0x04)
Page  Offset Size        Value Flags Description
0x01  =====  =               =  ===  == General Statistics (rev 1) ==
0x01  0x008  4              56  ---  Lifetime Power-On Resets
0x01  0x010  4            1277  ---  Power-on Hours
0x01  0x018  6      2722852111  ---  Logical Sectors Written
0x01  0x020  6        50590663  ---  Number of Write Commands
0x01  0x028  6      2155939653  ---  Logical Sectors Read
0x01  0x030  6        17579811  ---  Number of Read Commands
0x01  0x038  6         2686000  ---  Date and Time TimeStamp
0x04  =====  =               =  ===  == General Errors Statistics (rev 1) ==
0x04  0x008  4               0  ---  Number of Reported Uncorrectable Errors
0x04  0x010  4               0  ---  Resets Between Cmd Acceptance and Completion
0x05  =====  =               =  ===  == Temperature Statistics (rev 1) ==
0x05  0x008  1              17  ---  Current Temperature
0x05  0x020  1              24  ---  Highest Temperature
0x05  0x028  1              11  ---  Lowest Temperature
0x05  0x058  1              60  ---  Specified Maximum Operating Temperature
0x06  =====  =               =  ===  == Transport Statistics (rev 1) ==
0x06  0x008  4             124  ---  Number of Hardware Resets
0x06  0x010  4               0  ---  Number of ASR Events
0x06  0x018  4               0  ---  Number of Interface CRC Errors
0x07  =====  =               =  ===  == Solid State Device Statistics (rev 1) ==
0x07  0x008  1               0  N--  Percentage Used Endurance Indicator
                                |||_ C monitored condition met
                                ||__ D supports DSN
                                |___ N normalized value

Pending Defects log (GP Log 0x0c)
No Defects Logged

SATA Phy Event Counters (GP Log 0x11)
ID      Size     Value  Description
0x0001  2            0  Command failed due to ICRC error
0x0002  2            0  R_ERR response for data FIS
0x0003  2            0  R_ERR response for device-to-host data FIS
0x0004  2            0  R_ERR response for host-to-device data FIS
0x0005  2            0  R_ERR response for non-data FIS
0x0006  2            0  R_ERR response for device-to-host non-data FIS
0x0007  2            0  R_ERR response for host-to-device non-data FIS
0x0008  2            0  Device-to-host non-data FIS retries
0x0009  2            0  Transition from drive PhyRdy to drive PhyNRdy
0x000a  2            0  Device-to-host register FISes sent due to a COMRESET
0x000b  2            0  CRC errors within host-to-device FIS
0x000d  2            0  Non-CRC errors within host-to-device FIS
0x000f  2            0  R_ERR response for host-to-device data FIS, CRC
0x0010  2            0  R_ERR response for host-to-device data FIS, non-CRC
0x0012  2            0  R_ERR response for host-to-device non-data FIS, CRC
0x0013  2            0  R_ERR response for host-to-device non-data FIS, non-CRC


